body,title,url
"



    googletag.cmd.push(function() {
      googletag.display(""dfp-ad-top3_content"");
    });
  


Francely, de La Academia, se convirtió en la nueva Jolette.
En el concierto del 19 de enero fue de las más atacadas por los jueces.
En una de sus respuestas dijo: “Si el público no me saca, yo no me voy a ir”.
Esta frase recordó inmediatamente a Jolette, a quien concierto tras concierto la querían sacar, pero el público la mantuvo.
Y es que Francely tieneuna voz peculiar y talento, pero es la que menos avance ha mostrado.
Aunado a que fue parte del escándalo de Gibrán y Danna Paola.
VER: La verdadera historia de Jolette
Perfil de Francely
Su nombre completo es Francely Martínez Pérez Abreu. 
Nació el 10 de mayo del 2000 en Mérida, Yucatán.
En su primer concierto interpretó “Cómo hemos cambiado”, pero las críticas no fueron positivas.
Un malestar en la garganta y la actitud la llevaron a dar una mala presentación.
El rap es su género favorito y se describe como una persona alegre, positiva, versátil, carismática y auténtica.
Sus ojos claros llamaron la atención y es una de las más guapas de esta generación de La Academia.
La historia de amor que vivía con Gibrán quedó frustrada dos veces, por la salida del cantante.
TE PUEDE INTERESAR
14 participantes de La Academia 2019
La Academia en vivo 2019, dónde verla
","Francely de La Academia, la nueva Jolette",http://www.unionyucatan.mx/articulo/2020/01/24/espectaculos/francely-de-la-academia-la-nueva-jolette
